{
  "version": "0.1.0",
  "influence_rate_limit": "0.05/trait/day",
  "confidence_weighting": true,
  "trust_radius": {
    "min_reputation_threshold": 0.6,
    "shared_domain_required": true,
    "recent_interaction_required": false,
    "interaction_window_days": 30
  },
  "anomaly_detection": ["score_spikes", "feedback_loops", "collusion_rings"],
  "behavioral_throttling": {
    "max_score_delta_per_day": 0.1,
    "max_endorsements_per_day": 50,
    "max_challenges_per_day": 10,
    "cooldown_period_hours": 24
  },
  "challenge_and_prove": {
    "enabled": true,
    "auto_protection_threshold": 0.25,
    "challenge_bond_required": false
  },
  "audit_trails": {
    "log_all_score_changes": true,
    "log_feedback_cycles": true,
    "retention_days": 365
  }
}
